{
  "version": 1,
  "type": "distribution_log",
  "updated_at": "2026-05-29T01:05:18Z",
  "entries": [
    {
      "item_id": "new-fmcsa-carrier-leads-2026-05-2026-05-04",
      "slug": "new-fmcsa-carrier-leads-2026-05",
      "channel": "twitter",
      "posted_at": "2026-05-07T02:04:48Z",
      "status": "failed",
      "url": "",
      "content": "",
      "error": "Page.goto: Timeout 30000ms exceeded.\nCall log:\n  - navigating to \"https://x.com/home\", waiting until \"networkidle\"\n"
    },
    {
      "item_id": "new-fmcsa-carrier-leads-2026-05-2026-05-04",
      "slug": "new-fmcsa-carrier-leads-2026-05",
      "channel": "twitter",
      "posted_at": "2026-05-07T02:05:25Z",
      "status": "failed",
      "url": "",
      "content": "",
      "error": "Page.goto: Timeout 30000ms exceeded.\nCall log:\n  - navigating to \"https://x.com/home\", waiting until \"networkidle\"\n"
    },
    {
      "item_id": "new-fmcsa-carrier-leads-2026-05-2026-05-04",
      "slug": "new-fmcsa-carrier-leads-2026-05",
      "channel": "reddit:r/Truckers",
      "posted_at": "2026-05-07T02:06:52Z",
      "status": "failed",
      "url": "",
      "content": "",
      "error": "Page.fill: Timeout 30000ms exceeded.\nCall log:\n  - waiting for locator(\"#user_login\")\n"
    },
    {
      "item_id": "new-fmcsa-carrier-leads-2026-05-2026-05-04",
      "slug": "new-fmcsa-carrier-leads-2026-05",
      "channel": "reddit:r/Truckers",
      "posted_at": "2026-05-07T02:07:41Z",
      "status": "failed",
      "url": "",
      "content": "",
      "error": "Page.fill: Timeout 30000ms exceeded.\nCall log:\n  - waiting for locator(\"#user_login\")\n"
    },
    {
      "item_id": "new-fmcsa-carrier-leads-2026-05-2026-05-04",
      "slug": "new-fmcsa-carrier-leads-2026-05",
      "channel": "reddit:r/FreightBrokers",
      "posted_at": "2026-05-07T02:08:20Z",
      "status": "failed",
      "url": "",
      "content": "",
      "error": "bot-detection: old.reddit.com returning 403 (IP-level block); login form unreachable; systemic failure confirmed on this run"
    },
    {
      "item_id": "new-fmcsa-carrier-leads-2026-05-2026-05-04",
      "slug": "new-fmcsa-carrier-leads-2026-05",
      "channel": "reddit:r/Entrepreneur",
      "posted_at": "2026-05-07T02:08:20Z",
      "status": "failed",
      "url": "",
      "content": "",
      "error": "bot-detection: old.reddit.com returning 403 (IP-level block); login form unreachable; systemic failure confirmed on this run"
    },
    {
      "item_id": "new-business-formations-csv-2026-05-2026-05-05",
      "slug": "new-business-formations-csv-2026-05",
      "channel": "twitter",
      "posted_at": "2026-05-07T02:08:20Z",
      "status": "failed",
      "url": "",
      "content": "",
      "error": "networkidle-timeout: x.com never reaches networkidle state; systemic IP-level bot detection confirmed on this run"
    },
    {
      "item_id": "new-business-formations-csv-2026-05-2026-05-05",
      "slug": "new-business-formations-csv-2026-05",
      "channel": "reddit:r/smallbusiness",
      "posted_at": "2026-05-07T02:08:20Z",
      "status": "failed",
      "url": "",
      "content": "",
      "error": "bot-detection: old.reddit.com returning 403 (IP-level block); login form unreachable; systemic failure confirmed on this run"
    },
    {
      "item_id": "new-business-formations-csv-2026-05-2026-05-05",
      "slug": "new-business-formations-csv-2026-05",
      "channel": "reddit:r/Entrepreneur",
      "posted_at": "2026-05-07T02:08:20Z",
      "status": "failed",
      "url": "",
      "content": "",
      "error": "bot-detection: old.reddit.com returning 403 (IP-level block); login form unreachable; systemic failure confirmed on this run"
    },
    {
      "item_id": "samgov-small-biz-contractor-leads-2026-05-2026-05-05",
      "slug": "samgov-small-biz-contractor-leads-2026-05",
      "channel": "twitter",
      "posted_at": "2026-05-07T02:08:20Z",
      "status": "failed",
      "url": "",
      "content": "",
      "error": "networkidle-timeout: x.com never reaches networkidle state; systemic IP-level bot detection confirmed on this run"
    },
    {
      "item_id": "samgov-small-biz-contractor-leads-2026-05-2026-05-05",
      "slug": "samgov-small-biz-contractor-leads-2026-05",
      "channel": "reddit:r/govcontracting",
      "posted_at": "2026-05-07T02:08:20Z",
      "status": "failed",
      "url": "",
      "content": "",
      "error": "bot-detection: old.reddit.com returning 403 (IP-level block); login form unreachable; systemic failure confirmed on this run"
    },
    {
      "item_id": "samgov-small-biz-contractor-leads-2026-05-2026-05-05",
      "slug": "samgov-small-biz-contractor-leads-2026-05",
      "channel": "reddit:r/consulting",
      "posted_at": "2026-05-07T02:08:20Z",
      "status": "failed",
      "url": "",
      "content": "",
      "error": "bot-detection: old.reddit.com returning 403 (IP-level block); login form unreachable; systemic failure confirmed on this run"
    },
    {
      "item_id": "samgov-small-biz-contractor-leads-2026-05-2026-05-05",
      "slug": "samgov-small-biz-contractor-leads-2026-05",
      "channel": "reddit:r/Entrepreneur",
      "posted_at": "2026-05-07T02:08:20Z",
      "status": "failed",
      "url": "",
      "content": "",
      "error": "bot-detection: old.reddit.com returning 403 (IP-level block); login form unreachable; systemic failure confirmed on this run"
    },
    {
      "item_id": "fl-real-estate-agent-licenses-2026-05-2026-05-06",
      "slug": "fl-real-estate-agent-licenses-2026-05",
      "channel": "twitter",
      "posted_at": "2026-05-07T02:08:20Z",
      "status": "failed",
      "url": "",
      "content": "",
      "error": "networkidle-timeout: x.com never reaches networkidle state; systemic IP-level bot detection confirmed on this run"
    },
    {
      "item_id": "fl-real-estate-agent-licenses-2026-05-2026-05-06",
      "slug": "fl-real-estate-agent-licenses-2026-05",
      "channel": "reddit:r/realtors",
      "posted_at": "2026-05-07T02:08:20Z",
      "status": "failed",
      "url": "",
      "content": "",
      "error": "bot-detection: old.reddit.com returning 403 (IP-level block); login form unreachable; systemic failure confirmed on this run"
    },
    {
      "item_id": "fl-real-estate-agent-licenses-2026-05-2026-05-06",
      "slug": "fl-real-estate-agent-licenses-2026-05",
      "channel": "reddit:r/RealEstate",
      "posted_at": "2026-05-07T02:08:20Z",
      "status": "failed",
      "url": "",
      "content": "",
      "error": "bot-detection: old.reddit.com returning 403 (IP-level block); login form unreachable; systemic failure confirmed on this run"
    },
    {
      "item_id": "fl-real-estate-agent-licenses-2026-05-2026-05-06",
      "slug": "fl-real-estate-agent-licenses-2026-05",
      "channel": "reddit:r/Entrepreneur",
      "posted_at": "2026-05-07T02:08:20Z",
      "status": "failed",
      "url": "",
      "content": "",
      "error": "bot-detection: old.reddit.com returning 403 (IP-level block); login form unreachable; systemic failure confirmed on this run"
    },
    {
      "item_id": "new-fmcsa-carrier-leads-2026-05-2026-05-04",
      "slug": "new-fmcsa-carrier-leads-2026-05",
      "channel": "twitter",
      "posted_at": "2026-05-07T03:29:29Z",
      "status": "failed",
      "url": "",
      "content": "",
      "error": "Locator.wait_for: Timeout 10000ms exceeded.\nCall log:\n  - waiting for locator(\"[data-testid='tweetTextarea_0']\") to be visible\n"
    },
    {
      "item_id": "new-fmcsa-carrier-leads-2026-05-2026-05-04",
      "slug": "new-fmcsa-carrier-leads-2026-05",
      "channel": "linkedin",
      "posted_at": "2026-05-07T03:38:50Z",
      "status": "failed",
      "url": "",
      "content": "",
      "error": "Locator.wait_for: Timeout 8000ms exceeded.\nCall log:\n  - waiting for locator(\"button.share-actions__primary-action, button[aria-label='Post'], button:has-text('Post'):not(:has-text('Start'))\").first to be visible\n    21 × locator resolved to hidden <button type=\"button\" class=\"a37ba6ab be009a74 acc2b607 f8b3e4f0 _8ae12320 _6fc9ee90 _4d01b37c _5f7794b7 _2b9c3576 f8142a65 cb8918f7 _3b352da4 d9981ad5 f40e615c _58e03272\">…</button>\n"
    },
    {
      "item_id": "new-fmcsa-carrier-leads-2026-05-2026-05-04",
      "slug": "new-fmcsa-carrier-leads-2026-05",
      "channel": "linkedin",
      "posted_at": "2026-05-07T03:41:24Z",
      "status": "posted",
      "url": "https://www.linkedin.com",
      "content": "🚚 15,770 new FMCSA carrier registrations from DOT public data.\n\nUseful for trucking insurance agents, ELD vendors, and freight factoring reps prospecting new operators.\n\nCSV. $39 → https://buy.stripe.com/cNi14g4CP7aT8mT1iC7IY0c\n\n#Trucking #Logistics #DataProducts"
    },
    {
      "item_id": "new-business-formations-csv-2026-05-2026-05-05",
      "slug": "new-business-formations-csv-2026-05",
      "channel": "linkedin",
      "posted_at": "2026-05-07T03:41:51Z",
      "status": "posted",
      "url": "https://www.linkedin.com",
      "content": "📋 15,997 new Florida LLCs & corps from state filings.\n\nTarget new businesses before your competitors find them — ideal for insurance agents, CPAs, registered agent firms.\n\nCSV. $49 → https://buy.stripe.com/aFaaEQc5h66Pbz5f9s7IY0f\n\n#SmallBusiness #Florida #DataProducts"
    },
    {
      "item_id": "samgov-small-biz-contractor-leads-2026-05-2026-05-05",
      "slug": "samgov-small-biz-contractor-leads-2026-05",
      "channel": "linkedin",
      "posted_at": "2026-05-07T03:42:15Z",
      "status": "posted",
      "url": "https://www.linkedin.com",
      "content": "🏛️ 4,731 SAM.gov small-biz IT contractors in the DC/MD/VA corridor.\n\nFor gov contracting teaming partners, IT staffing agencies, and SaaS vendors targeting federal contractors.\n\nCSV. $49 → https://buy.stripe.com/dRm5kwb1dfHp7iPe5o7IY0g\n\n#GovCon #B2B #DataProducts"
    },
    {